{
  "$schema": "https://json-schema.org/draft/2020-12/schema",
  "$id": "https://dominion.local/schemas/agent_candidate.schema.json",
  "title": "Dominion Agent Candidate",
  "type": "object",
  "additionalProperties": false,
  "required": ["id", "role", "purpose", "owner", "requested_actions", "prohibited_actions", "input_contract", "output_contract", "success_metrics", "failure_modes", "data_classification", "tool_allowlist", "escalates_to"],
  "properties": {
    "id": {"type": "string", "pattern": "^[a-z][a-z0-9_-]{2,63}$"},
    "role": {"type": "string", "minLength": 1},
    "purpose": {"type": "string", "minLength": 1},
    "owner": {"const": "human_overseer"},
    "requested_actions": {"type": "array", "uniqueItems": true, "items": {"type": "string"}},
    "prohibited_actions": {"type": "array", "minItems": 1, "uniqueItems": true, "items": {"type": "string"}},
    "input_contract": {"type": "object", "minProperties": 1},
    "output_contract": {"type": "object", "minProperties": 1},
    "success_metrics": {"type": "array", "minItems": 1, "items": {"type": "string"}},
    "failure_modes": {"type": "array", "minItems": 1, "items": {"type": "string"}},
    "data_classification": {"enum": ["PUBLIC", "INTERNAL", "CONFIDENTIAL", "RESTRICTED"]},
    "tool_allowlist": {"type": "array", "uniqueItems": true, "items": {"type": "string"}},
    "escalates_to": {"type": "string", "minLength": 1}
  }
}
